{
  "version": 1,
  "profile": "gzcoord",
  "endpoint": "gzcoord",
  "port_range": [
    47100,
    47199
  ],
  "rows": [
    {
      "agent_id": "01a11615-14e1-7139-975c-84ad21a5c91f",
      "endpoint": "gzcoord",
      "identity_show": "12D3KooWFmMwKdw2SsDThQVG47TcRS8ETKCcALvoU68PHnME7ExA\n",
      "login": "python-dev-02",
      "login_signature": "-----BEGIN PGP SIGNATURE-----\n\niHUEABYKAB0WIQTWB2+sumzebJBm6S1LqnJRphf9UwUCat5R2QAKCRBLqnJRphf9\nU2UTAP9TKajzYFY1GA1ai7qxqjsMEcMiG9ZtduZjOMsI/BTCWgEAmffpQSOIXgnT\nH3+S7MFikQd17jQKL0bclYrrRPWJgA0=\n=+c4m\n-----END PGP SIGNATURE-----\n",
      "peer_id": "12D3KooWFmMwKdw2SsDThQVG47TcRS8ETKCcALvoU68PHnME7ExA",
      "port": 47101,
      "countersignature": "-----BEGIN PGP SIGNATURE-----\n\niHUEABYKAB0WIQTWt33kU1o4LDZ2XffXDobMImJA6gUCat5SFgAKCRDXDobMImJA\n6k+cAQCI6HJnY401CeqRFm2CdakjgMoW+1Y2ykJqkiovfSVdJwD+Kt13tvMTuylC\nZe0/eywxHw5JcuHsRJ/gWXGp9NnwdQ0=\n=FH/H\n-----END PGP SIGNATURE-----\n"
    },
    {
      "agent_id": "01a11a69-f363-7de9-b212-88785c3128e2",
      "endpoint": "gzcoord",
      "identity_show": "12D3KooWLHjHbABsmz2d2ZuyJQVsPDwyR9AY2X1pVArJpGhr2RFL\n",
      "login": "python-dev-03",
      "login_signature": "-----BEGIN PGP SIGNATURE-----\n\niHUEABYKAB0WIQSaXbEiP6NxjcGq4BcP1Xa9WAlprwUCat5R7gAKCRAP1Xa9WAlp\nryzmAP90JHMNT/xOhF/lSx/5jao6Sz17J4LJ4ugkK10fuOobTwD/e8+6Mi0cJU83\nrlDxGaxzAEop71HRXzeOThHJZxR15wA=\n=GMMo\n-----END PGP SIGNATURE-----\n",
      "peer_id": "12D3KooWLHjHbABsmz2d2ZuyJQVsPDwyR9AY2X1pVArJpGhr2RFL",
      "port": 47102,
      "countersignature": "-----BEGIN PGP SIGNATURE-----\n\niHUEABYKAB0WIQTWt33kU1o4LDZ2XffXDobMImJA6gUCat5SFwAKCRDXDobMImJA\n6rw2AP9Q7zw+lXRv/StLMtqezxpmxM6A5IEk5huyOrtvN6B2wgD9HFSKhJ0nifjT\nmKAVFkWlul5IZojaAZWqnYvNnGIDKQk=\n=VY0W\n-----END PGP SIGNATURE-----\n"
    },
    {
      "agent_id": "019ffcb2-78fd-7670-93fc-a3577216395f",
      "endpoint": "gzcoord",
      "identity_show": "12D3KooWM3d5cqcjBnFei9yzf9jqToTNbuqNp3M9n59r2L1bznJk\n",
      "login": "architect-cto-01",
      "login_signature": "-----BEGIN PGP SIGNATURE-----\n\niHQEABYKAB0WIQSvUy4H9Qq74riqhzKSzyB4Aq7HaAUCat5iywAKCRCSzyB4Aq7H\naOYoAP9sW/y/V02mUyu1+wPUN7OuEtAZv2u2ZHEEX8hxQR8GZQD2KL4ZCtLjYqU8\nnKC4SZa8itOtEiKfdna34tqnDI4dDQ==\n=S5K4\n-----END PGP SIGNATURE-----\n",
      "peer_id": "12D3KooWM3d5cqcjBnFei9yzf9jqToTNbuqNp3M9n59r2L1bznJk",
      "port": 47103,
      "countersignature": "-----BEGIN PGP SIGNATURE-----\n\niHUEABYKAB0WIQTWt33kU1o4LDZ2XffXDobMImJA6gUCat5khQAKCRDXDobMImJA\n6phLAP4i4THBQP+RA5u/bGH52Df8V/51BFVemggmfCAa+zrYPAEAqqI+gCnzt8Nb\nS3EJf2yOVVOFsj/eqXKQ6jARYO54ywk=\n=Uq1c\n-----END PGP SIGNATURE-----\n"
    },
    {
      "agent_id": "01a00bc1-4716-7e1f-bc43-931dc632f798",
      "endpoint": "gzcoord",
      "identity_show": "12D3KooWG4KVkeRBTXNoB1jDJBzw2totcTU5VXw1uJDP9gZqyGme\n",
      "login": "backend-dev-01",
      "login_signature": "-----BEGIN PGP SIGNATURE-----\n\niHUEABYKAB0WIQQ9obxJxnOzS0jpmqR4VQgFEpsGnAUCat5i4AAKCRB4VQgFEpsG\nnBkBAP0R4RHQg2N4vdXm+xfw+Gkdo4ANccgWiMM2yVcvrTLmJgD/SnGYHGnE+y6T\nvk78m/8ZPsGPhHQFyO9VUKdP6ZPLCQE=\n=0Jdo\n-----END PGP SIGNATURE-----\n",
      "peer_id": "12D3KooWG4KVkeRBTXNoB1jDJBzw2totcTU5VXw1uJDP9gZqyGme",
      "port": 47104,
      "countersignature": "-----BEGIN PGP SIGNATURE-----\n\niHUEABYKAB0WIQTWt33kU1o4LDZ2XffXDobMImJA6gUCat5kiAAKCRDXDobMImJA\n6qGaAP489Pk9QIlGi2cctwkWQq7D7PwwgSMu3Q4SAm4f4qFbPAD/cS1vdLdAOOr4\nRR0+vIkbDWxvXK4J/JxRCS3YraYCVAo=\n=fhuh\n-----END PGP SIGNATURE-----\n"
    },
    {
      "agent_id": "01a00bc1-473a-7be3-bfe2-4b1814f37e09",
      "endpoint": "gzcoord",
      "identity_show": "12D3KooWQg5XjAjNnmRzd5z1R8CW6SeTrbCSxRiYx2aj2RP44a9V\n",
      "login": "backend-dev-02",
      "login_signature": "-----BEGIN PGP SIGNATURE-----\n\niHUEABYKAB0WIQQtKlFm+TO3GVMeZ5qDUYqrkk4KCAUCat5i7wAKCRCDUYqrkk4K\nCFJcAP9jeD/bRdgRnymyl1cafj+8Be6hzZESbAyUuGwgq6sIvAD/SC30XBqknaGJ\nyrjd4VgLk5qlcJw8quLP2WWlJSh9lQo=\n=Lpkn\n-----END PGP SIGNATURE-----\n",
      "peer_id": "12D3KooWQg5XjAjNnmRzd5z1R8CW6SeTrbCSxRiYx2aj2RP44a9V",
      "port": 47105,
      "countersignature": "-----BEGIN PGP SIGNATURE-----\n\niHUEABYKAB0WIQTWt33kU1o4LDZ2XffXDobMImJA6gUCat5kiwAKCRDXDobMImJA\n6vFAAQD7hsyBAsljgzmo7//iT0QUdffUyOoeP0gOAF5xgNWXUQEAv8Vcvmfudru0\n4A+NpudaMT0s2anOvhkffwKYga6AKw0=\n=doq9\n-----END PGP SIGNATURE-----\n"
    },
    {
      "agent_id": "01a0a6a1-bfd6-7967-af5c-34ea643640a3",
      "endpoint": "gzcoord",
      "identity_show": "12D3KooWN8anav4A58jHWtvbNG3kVnSyrFpBsjvh8wvWrPueo7Wy\n",
      "login": "brand-comms-01",
      "login_signature": "-----BEGIN PGP SIGNATURE-----\n\niHUEABYKAB0WIQTsQ6xEKeouew9Kx90L3CLyfPkMtAUCat5jHQAKCRAL3CLyfPkM\ntKWZAP9A2tDGthwPTm1HpmV6wG7cF31M6+yvnwMnKO6Z1zaLYwD/RVam4JF7qctt\nE15gXomY+shLoT40+60pCS+qXXazZwg=\n=KA7e\n-----END PGP SIGNATURE-----\n",
      "peer_id": "12D3KooWN8anav4A58jHWtvbNG3kVnSyrFpBsjvh8wvWrPueo7Wy",
      "port": 47106,
      "countersignature": "-----BEGIN PGP SIGNATURE-----\n\niHUEABYKAB0WIQTWt33kU1o4LDZ2XffXDobMImJA6gUCat5kjgAKCRDXDobMImJA\n6rFSAQDGHDj2gLA+b1IsO6oJu4kyxPUXIyMf1gj/igTobuoB/gD8Dlk9Mx7byKjw\nqxLMIN9MFHnHA0rcVFM2us6/LdE8/Qo=\n=AowC\n-----END PGP SIGNATURE-----\n"
    },
    {
      "agent_id": "01a00bc1-475f-791e-a72f-4ce38715e628",
      "endpoint": "gzcoord",
      "identity_show": "12D3KooWGCkeWWgXjFTuLDJTwkvXbCB2qihA2GAt28U1K9RhfAsQ\n",
      "login": "db-admin",
      "login_signature": "-----BEGIN PGP SIGNATURE-----\n\niHUEABYKAB0WIQQRBZm5azuVulitzY+MpipumMyL8AUCat5i8wAKCRCMpipumMyL\n8IDBAQDxHRv1rR0l6YEQUj1NbkAJs7/6j/NHl/U8U57VKRguJgEA23+fCMOrZGgP\ndAhmbtkPbljsIdobmIaGlmKHWgDYEAU=\n=ldn7\n-----END PGP SIGNATURE-----\n",
      "peer_id": "12D3KooWGCkeWWgXjFTuLDJTwkvXbCB2qihA2GAt28U1K9RhfAsQ",
      "port": 47107,
      "countersignature": "-----BEGIN PGP SIGNATURE-----\n\niHUEABYKAB0WIQTWt33kU1o4LDZ2XffXDobMImJA6gUCat5kkQAKCRDXDobMImJA\n6m3qAP0V/lqiaNlgVDSdUWT8V05NBt+axBXwtS6DShuTEsIoYQEA4R2Vp/4Z96p1\n+XDptLsHdYsL0pJ3DaXD4x2BZOcudg4=\n=/efQ\n-----END PGP SIGNATURE-----\n"
    },
    {
      "agent_id": "01a00bc1-47e7-7bc8-9a0d-2e436f5740de",
      "endpoint": "gzcoord",
      "identity_show": "12D3KooWKrPKCQcfatopt55Q4p7p92AvVbt5KVZc5TCEFwnkS5Hq\n",
      "login": "devex-tooling",
      "login_signature": "-----BEGIN PGP SIGNATURE-----\n\niHUEABYKAB0WIQTorAC8Cj1Nrw2MaSrdq2i9FKew/wUCat5i5AAKCRDdq2i9FKew\n/3r1AP0X5jKNJuGDoV8M4ItcMZKltjpinJ8Uq053+CBzAo1i9wD9GpF1g6WgHx5T\n9KVqOTN03eye/+/ObOR5xVsAnOSetAk=\n=11AG\n-----END PGP SIGNATURE-----\n",
      "peer_id": "12D3KooWKrPKCQcfatopt55Q4p7p92AvVbt5KVZc5TCEFwnkS5Hq",
      "port": 47108,
      "countersignature": "-----BEGIN PGP SIGNATURE-----\n\niHUEABYKAB0WIQTWt33kU1o4LDZ2XffXDobMImJA6gUCat5klQAKCRDXDobMImJA\n6gFVAP9tV6Cr8jtK8VMDlXB7ATr/rHsHI1B45+FUnEzRu0zRpQEAke8NXGEpOFVu\nm86cyd+96JXcwRhyPbZzpaxFqjk/JAE=\n=ZFYi\n-----END PGP SIGNATURE-----\n"
    },
    {
      "agent_id": "01a00bc1-4824-7ace-a01e-6e46a11f9acc",
      "endpoint": "gzcoord",
      "identity_show": "12D3KooWPHpG1xQ9CwzW5wcjP9FfQicMEath4bvvLUxB2RyLrPse\n",
      "login": "domain-transit",
      "login_signature": "-----BEGIN PGP SIGNATURE-----\n\niHUEABYKAB0WIQQaJPD2mikksGZmSmPWaLpLUHpK3gUCat5i/gAKCRDWaLpLUHpK\n3qX7AP9wlu5BCAfCqVoFhV9MAOU3gANsChume3bt6JtgzvqdmQEAj5DxxBnFueCp\ngU03/EPQ5g2XQJ8KAkaNdjJHj2m6pAU=\n=Jmr0\n-----END PGP SIGNATURE-----\n",
      "peer_id": "12D3KooWPHpG1xQ9CwzW5wcjP9FfQicMEath4bvvLUxB2RyLrPse",
      "port": 47109,
      "countersignature": "-----BEGIN PGP SIGNATURE-----\n\niHUEABYKAB0WIQTWt33kU1o4LDZ2XffXDobMImJA6gUCat5kmgAKCRDXDobMImJA\n6lvFAQCm9lOaX7U1+baNDWtBkYzopbpg7/g9ElN2fVW4gp2JbAEAlts0ERs2XvF+\nLFqAqrY27ggW1RPZ4oyoYdm2mLkpNgw=\n=j5gv\n-----END PGP SIGNATURE-----\n"
    },
    {
      "agent_id": "01a00bc1-4805-7e5b-ab38-2fe6e65b2eed",
      "endpoint": "gzcoord",
      "identity_show": "12D3KooWShnbNnP9g2QXbJZ8hW2uW8VyStScnb2u3p96kZtUZ6qF\n",
      "login": "edge-hosting",
      "login_signature": "-----BEGIN PGP SIGNATURE-----\n\niHUEABYKAB0WIQSePGFK03IzksKPhGqkjmMhKLGLhAUCat5i+AAKCRCkjmMhKLGL\nhDTwAP9t2AfkqM+sX+JmGxZZMyZcCsDHAdBpavEDo8ZJ3S1DGgEAp6tSAyBSRdLL\nKc5Ir6jU/mcn5u5x8Y+CBNovpAEWdwU=\n=WxZk\n-----END PGP SIGNATURE-----\n",
      "peer_id": "12D3KooWShnbNnP9g2QXbJZ8hW2uW8VyStScnb2u3p96kZtUZ6qF",
      "port": 47110,
      "countersignature": "-----BEGIN PGP SIGNATURE-----\n\niHUEABYKAB0WIQTWt33kU1o4LDZ2XffXDobMImJA6gUCat5kngAKCRDXDobMImJA\n6gfBAP0YTqHqWhAXRPVatFCUCl0SXSzJUeG87A5Y8eocMwBBoAEAw3YZwdqglI1n\nZpVMYEqPClWhqddPvgqbJGGHaBLjGgQ=\n=2A+/\n-----END PGP SIGNATURE-----\n"
    },
    {
      "agent_id": "01a00bc1-47ae-77e3-82cd-263b23004b9a",
      "endpoint": "gzcoord",
      "identity_show": "12D3KooWETetK58HZgtHQsNAvYeBfjwKBw9ZibBv4qxRv5kaUu5r\n",
      "login": "flutter-dev-01",
      "login_signature": "-----BEGIN PGP SIGNATURE-----\n\niHUEABYKAB0WIQRkf02/qTpfJYVLAfPYsG4WzeJ5ZgUCat5i2wAKCRDYsG4WzeJ5\nZluQAP4mU9nGJuqtbMEmfos7kYYlxHpm1qrzx9PjQ5CcTfKtEQEAs4C0of33RyaG\nxwtn4gX0lULS78SigtYSNEw5FMVqWAI=\n=CUvF\n-----END PGP SIGNATURE-----\n",
      "peer_id": "12D3KooWETetK58HZgtHQsNAvYeBfjwKBw9ZibBv4qxRv5kaUu5r",
      "port": 47111,
      "countersignature": "-----BEGIN PGP SIGNATURE-----\n\niHUEABYKAB0WIQTWt33kU1o4LDZ2XffXDobMImJA6gUCat5kowAKCRDXDobMImJA\n6pWnAQDGH2CwhoB2gMQlGzJDqq4c2TvLf86K36kxUVVK+IZU4QD/ZfBv3CU6xV1R\nwM9U+Fmaa19MgJGnnSM+RetMS+r83AQ=\n=NApD\n-----END PGP SIGNATURE-----\n"
    },
    {
      "agent_id": "01a1181e-00d9-7754-9b26-445987f94160",
      "endpoint": "gzcoord",
      "identity_show": "12D3KooWNSt21zJrQgVUg2bpmnAKFTgLahyMqaBuQM3WKLhoRtnh\n",
      "login": "language-culture-en",
      "login_signature": "-----BEGIN PGP SIGNATURE-----\n\niHUEABYKAB0WIQQxewvOBXDk2zGclBwX4SKDt64NxgUCat5jQQAKCRAX4SKDt64N\nxkSaAP95aDwLuHjK/RazTXJbAJzhm8nzAnLS3lCo6KzRF3ajQAEAzRpV3ZzLchuX\nJmeuTPYEbfCclCRBW9znI34yURAddgc=\n=P6Fw\n-----END PGP SIGNATURE-----\n",
      "peer_id": "12D3KooWNSt21zJrQgVUg2bpmnAKFTgLahyMqaBuQM3WKLhoRtnh",
      "port": 47112,